<?xml version="1.0" encoding="ISO-8859-1"?>
<!DOCTYPE biblio SYSTEM "library.dtd">
<biblio> 
  <livre livre_id="_001">
    <!-- premier élément de type livre -->
    <titre>Les Misérables</titre>
    <auteur>Victor Hugo</auteur>
    <nb_tomes value="3"/>
  </livre>  
  <livre livre_id="_002" type="roman">
    <titre>L'Assomoir</titre>
    <auteur>Émile Zola</auteur>
  </livre> 
  <livre livre_id="_003" lang="en" type="roman">
    <titre>David Copperfield</titre>
    <auteur country="GB">Charles Dickens</auteur>
    <auteur country="GB">le fils de Charles Dickens</auteur>
    <nb_tomes value="2"/>
  </livre>
</biblio>